{
  "name": "codex-typecheck",
  "description": "A Codex CLI session: plan turned into todos, a command-execution approval with the app-server v2 option ids, a steered message inside a running turn, then a queued message that starts the next turn.",
  "device": {
    "device_id": "c5efb1ec-2912-4619-90f7-93b5172fd712",
    "name": "mac-studio-office",
    "platform": "macos",
    "hostname": "mac-studio.local",
    "arch": "arm64",
    "client_version": "0.1.0",
    "online": true,
    "last_seen": 1788944400000,
    "created_at": 1788426000000,
    "latency_ms": 18,
    "agents": [
      {
        "agent": "codex",
        "available": true,
        "version": "0.153.4",
        "path": "/opt/homebrew/bin/codex",
        "models": [
          {
            "id": "gpt-5.4-codex",
            "label": "GPT-5.4 Codex"
          },
          {
            "id": "gpt-5.4-codex-mini",
            "label": "GPT-5.4 Codex mini"
          }
        ],
        "default_model": "gpt-5.4-codex",
        "permission_modes": [
          {
            "id": "untrusted",
            "label": "Ask for everything"
          },
          {
            "id": "on-request",
            "label": "Ask when needed"
          },
          {
            "id": "never",
            "label": "Never ask"
          }
        ],
        "default_permission_mode": "on-request",
        "efforts": [
          {
            "id": "low",
            "label": "Low"
          },
          {
            "id": "medium",
            "label": "Medium"
          },
          {
            "id": "high",
            "label": "High"
          }
        ],
        "default_effort": "medium",
        "capabilities": [
          "worktree",
          "interrupt",
          "queue",
          "steer",
          "attachments",
          "effort",
          "history",
          "commands"
        ]
      }
    ]
  },
  "session": {
    "session_id": "9cabb33b-a6e2-4faf-a905-865f89dcfa8e",
    "device_id": "c5efb1ec-2912-4619-90f7-93b5172fd712",
    "agent": "codex",
    "title": "Typecheck the web app",
    "cwd": "/Users/me/dev/web",
    "git": {
      "branch": "feat/settings-drawer",
      "dirty": true,
      "ahead": 2,
      "behind": 0,
      "worktree": false
    },
    "state": "idle",
    "state_detail": null,
    "origin": "remote",
    "control": "remote",
    "model": "gpt-5.4-codex",
    "permission_mode": "on-request",
    "effort": "medium",
    "created_at": 1788944940000,
    "updated_at": 1788944999000,
    "last_seq": 0,
    "archived": false,
    "turn": null,
    "todos": null,
    "usage": null,
    "queued": 0
  },
  "session_final": {
    "session_id": "9cabb33b-a6e2-4faf-a905-865f89dcfa8e",
    "device_id": "c5efb1ec-2912-4619-90f7-93b5172fd712",
    "agent": "codex",
    "title": "Typecheck the web app",
    "cwd": "/Users/me/dev/web",
    "git": {
      "branch": "feat/settings-drawer",
      "dirty": true,
      "ahead": 2,
      "behind": 0,
      "worktree": false
    },
    "state": "idle",
    "state_detail": null,
    "origin": "remote",
    "control": "remote",
    "model": "gpt-5.4-codex",
    "permission_mode": "on-request",
    "effort": "medium",
    "created_at": 1788944940000,
    "updated_at": 1788945049900,
    "last_seq": 37,
    "archived": false,
    "turn": null,
    "todos": {
      "total": 3,
      "done": 3
    },
    "usage": {
      "input_tokens": 26800,
      "output_tokens": 3640,
      "total_tokens": 30440,
      "context_used": 36900,
      "context_window": 272000
    },
    "queued": 0
  },
  "frames": [
    {
      "type": "session.event",
      "session_id": "9cabb33b-a6e2-4faf-a905-865f89dcfa8e",
      "event": {
        "seq": 1,
        "ts": 1788945000000,
        "kind": "status",
        "state": "idle"
      }
    },
    {
      "type": "session.event",
      "session_id": "9cabb33b-a6e2-4faf-a905-865f89dcfa8e",
      "event": {
        "seq": 2,
        "ts": 1788945001000,
        "kind": "user_message",
        "block_id": "44913af8-2eb0-4c5c-af14-812734963563",
        "text": "Typecheck the web app and fix whatever it reports.",
        "source": "remote"
      }
    },
    {
      "type": "session.event",
      "session_id": "9cabb33b-a6e2-4faf-a905-865f89dcfa8e",
      "event": {
        "seq": 3,
        "ts": 1788945001100,
        "kind": "turn_started",
        "turn_id": "192a2a3b-0e93-4d42-bf6c-9d395dda731e",
        "trigger": "remote"
      }
    },
    {
      "type": "session.event",
      "session_id": "9cabb33b-a6e2-4faf-a905-865f89dcfa8e",
      "event": {
        "seq": 4,
        "ts": 1788945001100,
        "kind": "status",
        "state": "running"
      }
    },
    {
      "type": "session.event",
      "session_id": "9cabb33b-a6e2-4faf-a905-865f89dcfa8e",
      "event": {
        "seq": 5,
        "ts": 1788945002300,
        "kind": "thinking",
        "block_id": "cc93abde-890f-4962-82c2-4ef5e50fd67e",
        "delta": "Run the typecheck first to see the ",
        "done": false
      }
    },
    {
      "type": "session.event",
      "session_id": "9cabb33b-a6e2-4faf-a905-865f89dcfa8e",
      "event": {
        "seq": 6,
        "ts": 1788945002500,
        "kind": "thinking",
        "first_seq": 5,
        "block_id": "cc93abde-890f-4962-82c2-4ef5e50fd67e",
        "delta": "actual errors before touching anything.",
        "done": false
      }
    },
    {
      "type": "session.event",
      "session_id": "9cabb33b-a6e2-4faf-a905-865f89dcfa8e",
      "event": {
        "seq": 7,
        "ts": 1788945002700,
        "kind": "thinking",
        "first_seq": 5,
        "block_id": "cc93abde-890f-4962-82c2-4ef5e50fd67e",
        "text": "Run the typecheck first to see the actual errors before touching anything.",
        "done": true,
        "duration_ms": 1600
      }
    },
    {
      "type": "session.event",
      "session_id": "9cabb33b-a6e2-4faf-a905-865f89dcfa8e",
      "event": {
        "seq": 8,
        "ts": 1788945003000,
        "kind": "assistant_text",
        "block_id": "4db74cc3-a830-4108-b79e-7551e5b3a32b",
        "delta": "Starting with the typecheck.",
        "done": false
      }
    },
    {
      "type": "session.event",
      "session_id": "9cabb33b-a6e2-4faf-a905-865f89dcfa8e",
      "event": {
        "seq": 9,
        "ts": 1788945003200,
        "kind": "assistant_text",
        "first_seq": 8,
        "block_id": "4db74cc3-a830-4108-b79e-7551e5b3a32b",
        "text": "Starting with the typecheck.",
        "done": true
      }
    },
    {
      "type": "session.event",
      "session_id": "9cabb33b-a6e2-4faf-a905-865f89dcfa8e",
      "event": {
        "seq": 10,
        "ts": 1788945003400,
        "kind": "todos",
        "items": [
          {
            "id": "p1",
            "text": "Run npm run typecheck",
            "status": "in_progress"
          },
          {
            "id": "p2",
            "text": "Fix reported type errors",
            "status": "pending"
          },
          {
            "id": "p3",
            "text": "Re-run typecheck",
            "status": "pending"
          }
        ]
      }
    },
    {
      "type": "session.event",
      "session_id": "9cabb33b-a6e2-4faf-a905-865f89dcfa8e",
      "event": {
        "seq": 11,
        "ts": 1788945003800,
        "kind": "approval",
        "block_id": "395e65a8-79fd-40a8-8fbe-c5963c948e1e",
        "request_id": "89dac789-f956-41ad-bab8-196b43d681c7",
        "tool": "shell",
        "tool_kind": "shell",
        "title": "npm run typecheck",
        "input": {
          "command": [
            "npm",
            "run",
            "typecheck"
          ],
          "cwd": "/Users/me/dev/web"
        },
        "options": [
          {
            "id": "accept",
            "label": "Run once",
            "style": "primary"
          },
          {
            "id": "acceptForSession",
            "label": "Always allow in this session",
            "style": "secondary"
          },
          {
            "id": "decline",
            "label": "Decline",
            "style": "danger"
          },
          {
            "id": "cancel",
            "label": "Cancel the turn",
            "style": "danger"
          }
        ],
        "status": "pending"
      }
    },
    {
      "type": "session.event",
      "session_id": "9cabb33b-a6e2-4faf-a905-865f89dcfa8e",
      "event": {
        "seq": 12,
        "ts": 1788945003800,
        "kind": "status",
        "state": "needs_approval",
        "detail": "Run npm run typecheck"
      }
    },
    {
      "type": "session.event",
      "session_id": "9cabb33b-a6e2-4faf-a905-865f89dcfa8e",
      "event": {
        "seq": 13,
        "ts": 1788945012800,
        "kind": "approval",
        "first_seq": 11,
        "block_id": "395e65a8-79fd-40a8-8fbe-c5963c948e1e",
        "request_id": "89dac789-f956-41ad-bab8-196b43d681c7",
        "tool": "shell",
        "tool_kind": "shell",
        "title": "npm run typecheck",
        "input": {
          "command": [
            "npm",
            "run",
            "typecheck"
          ],
          "cwd": "/Users/me/dev/web"
        },
        "options": [
          {
            "id": "accept",
            "label": "Run once",
            "style": "primary"
          },
          {
            "id": "acceptForSession",
            "label": "Always allow in this session",
            "style": "secondary"
          },
          {
            "id": "decline",
            "label": "Decline",
            "style": "danger"
          },
          {
            "id": "cancel",
            "label": "Cancel the turn",
            "style": "danger"
          }
        ],
        "status": "resolved",
        "decision": {
          "option_id": "acceptForSession",
          "by": "remote"
        }
      }
    },
    {
      "type": "session.event",
      "session_id": "9cabb33b-a6e2-4faf-a905-865f89dcfa8e",
      "event": {
        "seq": 14,